{
  "schema_version": "amy.base-aware-mutation-development-check.v1-draft",
  "classification": "pre_registration_base_aware_disposable_fixture_test_not_confirmatory",
  "started_at": "2026-07-15T03:50:16.511961Z",
  "ended_at": "2026-07-15T03:50:17.805411Z",
  "command": [
    "/Volumes/Ganador disk/A.M.Y/experiments/verifiable_release_study/.venv/bin/python",
    "-m",
    "pytest",
    "-q",
    "tests/test_selected_profile_base_aware_mutations.py"
  ],
  "environment": {
    "python": "3.12.12",
    "python_implementation": "CPython",
    "platform": "macOS-26.5.2-arm64-arm-64bit",
    "machine": "arm64",
    "git": {
      "commit": "40663854cfc2a2cf8e8e828cc0ac7c031db58963",
      "dirty_or_untracked": true
    }
  },
  "source_inventory": [
    {
      "path": "amy_verifier/__init__.py",
      "bytes": 606,
      "sha256": "9e34fa0b311ac84f55ba2c383ef712130646bedd0be0c8437989a0e19dfdd732"
    },
    {
      "path": "amy_verifier/attestation.py",
      "bytes": 15064,
      "sha256": "109e84010c5cce3a7ae06e11626282434cde3f4457810fa138189f532d286966"
    },
    {
      "path": "amy_verifier/base_corpus.py",
      "bytes": 14399,
      "sha256": "4419f9db9e4f1db09fe5ff47d3e1d4626da5f0462578d6ba0dc57e2f919b5fce"
    },
    {
      "path": "amy_verifier/confirmatory_runner.py",
      "bytes": 74864,
      "sha256": "a68d23749bb72bad517bb12b86b92aab83d44c1aaabb282ce393173a70fa6c0c"
    },
    {
      "path": "amy_verifier/fixture_crypto.py",
      "bytes": 12039,
      "sha256": "f880fda8820b6edf1e53569353472d748e0e48c1689abaaf729bf7757138282e"
    },
    {
      "path": "amy_verifier/github_attestation.py",
      "bytes": 41451,
      "sha256": "6731d83c0ea94d0ce2029ce529a175c3eb9cd1d17e9698b090f47a72044fe6ac"
    },
    {
      "path": "amy_verifier/github_attestation_v2.py",
      "bytes": 18409,
      "sha256": "8f827b5ca836c65f2e484c2c779654086e79b84600d3ba3f7ea3d430ef207497"
    },
    {
      "path": "amy_verifier/github_attestation_v2_core.py",
      "bytes": 41998,
      "sha256": "1d53284fec664698e8aac89ccf6d4c8c37979d88f6a71425b3247575b2770bb9"
    },
    {
      "path": "amy_verifier/json_tools.py",
      "bytes": 5768,
      "sha256": "2c0d7c6a3a5558ac60639f558d9e9b61f64bff70d77c5226cfdcf5b6ed6cc903"
    },
    {
      "path": "amy_verifier/manifest.py",
      "bytes": 7629,
      "sha256": "b267ac496d4120ab14fb0d789d35d4d32774ab70f672de6e10f9e7099dc262ee"
    },
    {
      "path": "amy_verifier/model.py",
      "bytes": 1478,
      "sha256": "f1eee6d48fd0c9abbf38d96d68dc659c71735bc1003032f280089fa5cba3638b"
    },
    {
      "path": "amy_verifier/path_policy.py",
      "bytes": 13370,
      "sha256": "30f8ebab8c16c3ddc968e778ce0933c097b3439f912781c9854104aa9f90323a"
    },
    {
      "path": "amy_verifier/pilot.py",
      "bytes": 24397,
      "sha256": "b4f204510212f8d11e5dc14164460605741922797e37fdf5825dafde6829af30"
    },
    {
      "path": "amy_verifier/selected_profile_evaluator.py",
      "bytes": 1679,
      "sha256": "c30885f135bffbbc502adba8752831c82d34f8052b778e6ac0704d745798e3c6"
    },
    {
      "path": "amy_verifier/selected_profile_fixture.py",
      "bytes": 21596,
      "sha256": "770dfef37d0dd9a73d45909e06ab4c817b8110db15c64776cee9b9681f487f39"
    },
    {
      "path": "amy_verifier/selected_profile_mutations.py",
      "bytes": 26558,
      "sha256": "f09096aa8e8c7f218f7d5163e8384c2e2ed937579c2405f8402a9f10e80468bb"
    },
    {
      "path": "amy_verifier/selected_profile_oracle.py",
      "bytes": 5526,
      "sha256": "3d607070f66e8767751b66bb5cc421224ffba998d90debb30b88931872fb8305"
    },
    {
      "path": "amy_verifier/verifier.py",
      "bytes": 6703,
      "sha256": "6aa7b16cc5ed6f4bc470fcb07bdd407491ce0271abd5a20779e618597db3316f"
    },
    {
      "path": "corpus/BASE_REGISTRY_DRAFT.json",
      "bytes": 17066,
      "sha256": "553352619f5b1f4e96b9ccc482070e0fba4398298ba15d9a27457698117dc015"
    },
    {
      "path": "protocol/ATTACK_CATALOG_SELECTED_PROFILE_DRAFT.json",
      "bytes": 40769,
      "sha256": "098563afc029f8c1532999e3cc5c058c8bf3bdc33cfcfd01423decf56f4693b1"
    },
    {
      "path": "protocol/SELECTED_PROFILE_FIXTURE_POLICY_DRAFT.json",
      "bytes": 3178,
      "sha256": "93830e93f18428df461bdb865557ada52a8c3dbfdb427d2ab524226f16898731"
    },
    {
      "path": "pyproject.toml",
      "bytes": 497,
      "sha256": "8d1042a03fe74f320d6b71ee80a05da3e7e190bd64808914c5bf05460ec86af0"
    },
    {
      "path": "schemas/base-aware-mutation-development-check.schema.json",
      "bytes": 5502,
      "sha256": "17e7a7a36fea1c90c46d68279235961a08db12398796a87040ec5870f7dcf52a"
    },
    {
      "path": "scripts/run_base_aware_mutation_development_check.py",
      "bytes": 8451,
      "sha256": "4919ff06fbcec8d320728ba926315da22c4bf6bb74656578b080ba40449698d5"
    },
    {
      "path": "scripts/validate_base_aware_mutation_development_check.py",
      "bytes": 5886,
      "sha256": "3d706bd023c7f37a049069e40435c75e608e76163c078fd395c332329876e5b0"
    },
    {
      "path": "tests/test_selected_profile_base_aware_mutations.py",
      "bytes": 9613,
      "sha256": "6ea31ba54c88d31fcfccdc6c135455129fc3cf976d569146845c61cba3656bb4"
    },
    {
      "path": "uv.lock",
      "bytes": 74227,
      "sha256": "ada446114e2534983167988f875dea92b5d1d895a6a12a9db70e63626a3d9f41"
    }
  ],
  "source_inventory_pre_sha256": "3b2d95a7b4d6615b954b1732cbbd0afdbfd3bd7cde018cc52c7b337f519cfd55",
  "source_inventory_post_sha256": "3b2d95a7b4d6615b954b1732cbbd0afdbfd3bd7cde018cc52c7b337f519cfd55",
  "source_inventory_unchanged_during_execution": true,
  "execution": {
    "exit_code": 0,
    "stdout": "....                                                                     [100%]\n4 passed in 1.08s\n",
    "stdout_sha256": "98473117d0364dacd457d4f3b4d645cbd44b4756bdae6a1ee111b5f7856e9f01",
    "stderr": "",
    "stderr_sha256": "e3b0c44298fc1c149afbf4c8996fb92427ae41e4649b934ca495991b7852b855",
    "passed_test_count": 4
  },
  "declared_coverage": {
    "base_count": 6,
    "operator_count": 41,
    "base_operator_plan_count": 246,
    "resolved_plan_count": 245,
    "unavailable_plan_count": 1,
    "disposable_target_dependent_execution_count": 65,
    "policy_fixture_collision_tested": true,
    "forged_plan_rejection_tested": true
  },
  "unavailable_plans": [
    {
      "base_id": "B04-SOFTWARE",
      "operator_id": "INVENTORY-OMIT-ROLE-001",
      "reason_code": "TARGET_REQUIRED_ROLE_NOT_UNIQUE"
    }
  ],
  "boundaries": {
    "confirmatory_case_archives_created": false,
    "confirmatory_outcomes_read": false,
    "verifier_invoked_by_base_aware_test": false,
    "oracle_join_performed": false,
    "registered_result_ledger_written": false,
    "production_sigstore_conformance_established": false,
    "independent_review_performed": false
  },
  "decision": "NO-GO",
  "manuscript_claims_authorized": false
}
